گریه و با چهره همه لبخند بر مادربزرگ باران تبریک می باشد|wavs_chunk2794.wav
عجب موفقیتی مادمازل|wavs_chunk2795.wav
با لبخندی بازیگران افزود ولی خانوم یکپارچه|wavs_chunk2796.wav
کلیپ|wavs_chunk2797.wav
خانه ۱۲ هزار چه می گویند|wavs_chunk2798.wav
سکه های طلا را حساب نکردم روی هم می شود|wavs_chunk2799.wav
امشب چقدر نزدیک ۶ هزار|wavs_chunk2800.wav
من گفتم از ۷ هزار هم بیشتر می شود با نرخ روز|wavs_chunk2801.wav
سر به ۸۰۰۰ میزند ۸۰۰۰|wavs_chunk2802.wav
سادگی مرا تماشا|wavs_chunk2803.wav
شما بخورید|wavs_chunk2804.wav
مارو از خوشحالی در پیچ و تاب گفت|wavs_chunk2805.wav
مادر جانکم چه کردید چطور توانستید ۸۰۰۰|wavs_chunk2806.wav
ما تنها بر خدا|wavs_chunk2807.wav
برای واتساپ شماره خیز برداشتن|wavs_chunk2808.wav
دست‌هایش را بوسیدن|wavs_chunk2809.wav
آهنگ قصه دریا را می رانند|wavs_chunk2810.wav
بچه چجوری درست می شود|wavs_chunk2811.wav
تبریک می گویند به آنها هم ۱۱|wavs_chunk2812.wav
مرد سیبیلو ای که سرداری کهنه و جلیقه همه رنگی|wavs_chunk2813.wav
داشت و کلاه سر برداشته با کنار صندلی مادربزرگ|wavs_chunk2814.wav
با لبخند چاپلوسان گفت رمزبان|wavs_chunk2815.wav
من غریبم یک تبعیدی بی سر و سامان اشراف|wavs_chunk2816.wav
همه خیلی سخاوتمند|wavs_chunk2817.wav
کتاب شده است|wavs_chunk2818.wav
بلندم کن برویم|wavs_chunk2819.wav
رو به پایین کرد و بافت اسکاج یا فردا برای|wavs_chunk2820.wav
برای مادمازل هم اسمش چی بود پازل بند|wavs_chunk2821.wav
پول میدم یک پیراهن برای خودش بخرد|wavs_chunk2822.wav
ترجمه کن برایت مضر بلاش از راه تنفس|wavs_chunk2823.wav
زانوی خم کرد و ژنرال و دیگری او نگاه کنم دهان به پوزخندی|wavs_chunk2824.wav
مسی مدم ژنرال|wavs_chunk2825.wav
درد کشید و به راه درختی رسیدند انگاری باری از دلش برداشته شد|wavs_chunk2826.wav
مادربزرگ به یاد دایی که بچه هایشان را افتاد و گفت|wavs_chunk2827.wav
هلو سیاه سیاه باور نخواهد کرد|wavs_chunk2828.wav
باید یک چیزی بدهم|wavs_chunk2829.wav
بیگ داگ همه چیزی بده مرد خمیده|wavs_chunk2830.wav
ژنده پوشی بود که میگذشت و نگاهی به من انداخت|wavs_chunk2831.wav
آخر مادر بزرگ شاید گران باشد چه بسا که باز شیادی باشد|wavs_chunk2832.wav
|wavs_chunk2833.wav
من به جان باش رفتم اسکی بگذارم مرد با تعجب نگاه|wavs_chunk2834.wav
ماسک را گرفت و چیزی نگفت یک جنده عرق میداد|wavs_chunk2835.wav
امتحان نکردی|wavs_chunk2836.wav
مادربزرگ چشم هایش برق میزد|wavs_chunk2837.wav
خودم دیدم حتما یکبار امتحانش می کنم مادر|wavs_chunk2838.wav
اما بعد بگذار روی صفر|wavs_chunk2839.wav
چقدر داری|wavs_chunk2840.wav
بیشتر ندارم مادر بزرگ|wavs_chunk2841.wav
اگر بخواهیم ۵۰ فردی به تو قسم میدهم بیا همین بس که رابرت|wavs_chunk2842.wav
و ناگهان رو به ژنرال کرد و گفت|wavs_chunk2843.wav
شکم و اساس آب نمایی چیزی نمی دهم|wavs_chunk2844.wav
ژنرال یکی خوردم چیزی نگفت صورت دو گریه|wavs_chunk2845.wav
زیر لب به شهر گفت و گو|wavs_chunk2846.wav
بر خدا از این پیرزن مادر بزرگ|wavs_chunk2847.wav
بازی گدا|wavs_chunk2848.wav
اینبار پیرمردی بود که موی سفید|wavs_chunk2849.wav
پای چوبی بود و با صدای بلند کبوتر رنگی به تن و عصای بلند|wavs_chunk2850.wav
داشتن پسر و وزنش به سرباز پیری است|wavs_chunk2851.wav
گلبهی بدهم عقب رفت نگاه غضب آلود به من انداخت|wavs_chunk2852.wav
زد چیست مبالغه|wavs_chunk2853.wav
مادربزرگ دست از سر قیف شاندار|wavs_chunk2854.wav
خوب است برویم|wavs_chunk2855.wav
زود یک ناهار می خوریم و بعد کمی دراز میکشم|wavs_chunk2856.wav
باز برمیگردی مانکن با تعجب پرسیدم|wavs_chunk2857.wav
پس میخوای بازی کنی مادربزرگ کردی|wavs_chunk2858.wav
می پرسید شما را تماشا کنم|wavs_chunk2859.wav
استوری پیش آمد و گفت ولی آخر خانم جان|wavs_chunk2860.wav
ممکن است برگردد با یک بدشانسی ممکن است هر چه|wavs_chunk2861.wav
مخصوصاً با این جور بازی که شما می کنید|wavs_chunk2862.wav
ناک است|wavs_chunk2863.wav
جیک گنجشک ایمان است گفت شما حتماً خواهید|wavs_chunk2864.wav
|wavs_chunk2865.wav
بعد از من پرسید|wavs_chunk2866.wav
کجاست در ایستگاه مادربزرگ|wavs_chunk2867.wav
جوان خوب است به تلک رسیدیم|wavs_chunk2868.wav
بزرگ در پلکان صرف خدمت رادیو را صدا کرد و برایش خودستایی|wavs_chunk2869.wav
شرح شاهکار شاد برف در آسیا را خواست و ۰دید|wavs_chunk2870.wav
بخشید و دستور داد که ناهار بیاورند و سیاه|wavs_chunk2871.wav
غزال بست مجید اون می‌بستند|wavs_chunk2872.wav
به جیر جیر می مانست گفت نمیدانی|wavs_chunk2873.wav
به پات میگفتم این مادر جان ما چه خیالی دارد|wavs_chunk2874.wav
قتلهای پول است که بر هم وارد می شود خدایا|wavs_chunk2875.wav
این همه پول ندیده بودم و داره میزنه همه آقا ها نشسته بودند|wavs_chunk2876.wav
چه همه آقا می گفتم این همه ها از کجا آمدند|wavs_chunk2877.wav
توی دلم جا می کردم که یا مریم مقدس خودت حفظ کنیم|wavs_chunk2878.wav
همش دوتا می کردم دلم ضعف میرفت چیزی نمونده|wavs_chunk2879.wav
کنم و من مثل بید میرسیدم|wavs_chunk2880.wav
خدایا خودت نگهدارش باش خدا حفظتان کرد هنوز|wavs_chunk2881.wav
می کنم این روز تمام تنم میلرزد|wavs_chunk2882.wav
پیچ بعد از ناهار ساعت ۴ حاضر باش می رویم|wavs_chunk2883.wav
خداحافظ دکتر برای من خبر کنی باید به آب معدنی|wavs_chunk2884.wav
|wavs_chunk2885.wav
من که از نظر مادربزرگ بیرون کشیدن تصور کنم که|wavs_chunk2886.wav
چه خواهد شد و کارشان به کجا خواهد کشید|wavs_chunk2887.wav
دیدم که آنها خواسته ژنرال هنوز نتوانستند حتی از همان|wavs_chunk2888.wav
اول به حالت عادی خود باز آیند ظهور مادربزرگ|wavs_chunk2889.wav
رسیدن تلگرامی که حبابی سوی انتظارش را می کشیدند|wavs_chunk2890.wav
خبر مرگ او و نوید میراثش می شمردند چه قدر|wavs_chunk2891.wav
سریال هایی را که می پختند و تصمیم هایی که بر اساس آن گرفته بودند به هم ریخته|wavs_chunk2892.wav
شاهکارهای اخیرا در کازینو با حیرتی عقیقی|wavs_chunk2893.wav
گفت تشنج شدید دنبال می کردند|wavs_chunk2894.wav
با این حال رویداد دوم چه بسا مهمتر از واقعی تکان دهنده|wavs_chunk2895.wav
زیر و گرچه مادربزرگ بار جلوی همه گفته بود که|wavs_chunk2896.wav
نخواهد داد ولی کسی چه میدانست نمی باید امید به خدا|wavs_chunk2897.wav
اگر نبود که دوری و که در همه کارهای ژنرال دخالت دارد|wavs_chunk2898.wav
امید از دست نداده بود|wavs_chunk2899.wav
ماجرا ذینفع بود چطور ممکن بود نباشد همسر ژنرال|wavs_chunk2900.wav
منابع میراث بزرگ دست انداختن هنوز امیدوار بود|wavs_chunk2901.wav
چگونه دلبری از مادربزرگ کوتاهی نمی‌کرد عکس فایل های مد|wavs_chunk2902.wav
صاف و صادق که اهل حسابگری و چاپلوسی نبود|wavs_chunk2903.wav
حالا حالا که مادربزرگ در کازینو اینطور درخشیده بود|wavs_chunk2904.wav
او به این روشنی بر آنها آشکار شده بود|wavs_chunk2905.wav
تسلط جو و به کودکی بازگشته حالا چه وقته|wavs_chunk2906.wav
از دست رفته بود به کودکی می ماند|wavs_chunk2907.wav
بسته و بنابه معمول تا دیدار آخرش را میخواهد|wavs_chunk2908.wav
با خودم میگفتم خدایا مرا ببخش که با بسته بیدارم خونه|wavs_chunk2909.wav
هر سکه طلایی که مادربزرگ ساعتی پیش در کازینو روی میز|wavs_chunk2910.wav
خاری بود که در چشمشان را فرو می رفت و بخش می آورد|wavs_chunk2911.wav
فصل دوم آن را بر می گیرد و برایش مثل قاشق ها|wavs_chunk2912.wav
از جلوی دهانش می گذشت و برای او نبود|wavs_chunk2913.wav
این بود که حتی بعد از بردن از خوشحالی گرفتارت بست خواب شده|wavs_chunk2914.wav
حتی همه عابران را گدا می‌پنداشت نتوانسته بود|wavs_chunk2915.wav
خودرو جنرال پنهان دارد و به او گفته بود به تو چیزی نمی دهم|wavs_chunk2916.wav
این نشانه ها بود که این فکر و ذهنش خانه کرده بود به این فکر|wavs_chunk2917.wav
گفتی به خود قول داده بود خطرناک بود|wavs_chunk2918.wav
این فکرا زمانی در ذهن من زیرو رو میشه|wavs_chunk2919.wav
از اتاق مادربزرگ بیرون آمده بودم از فلکان شکوهمند|wavs_chunk2920.wav
خود در طبقه آخر میرفتم اینها همه ذهن مرا سخت|wavs_chunk2921.wav
فیلمی داشت که پیش از آمدن مادربزرگ نیز از روابط کار|wavs_chunk2922.wav
همراهان ما با هم بی خبر نبودم و بهت به کم و کیف آنها پی برد|wavs_chunk2923.wav
اما ظرایف این روابط و این هفته های این بازی را به یقین می دانست|wavs_chunk2924.wav
الینا هرگز با من کاملاً روراست نبود و همه چیز را به من نگو|wavs_chunk2925.wav
گرچه انصاف باید داد که گاهی باید راه|wavs_chunk2926.wav
راستگویی می‌کرد اما متوجه شده بودم که اغلب حتی می شود گفت|wavs_chunk2927.wav
به گفته هایش رنگ شوخی و مسخره می داد یا آنها را در پرده|wavs_chunk2928.wav
پیچی دو رنگ دروغگو آن‌ها می‌بخشید بله|wavs_chunk2929.wav
چیزها را از من پنهان می کرد در همه حال من احساس می کردم که|wavs_chunk2930.wav
این وضع مرموز و پر تنش نزدیک است|wavs_chunk2931.wav
دوتا همه پرده ها برداشته شود و کار به آخر برسد|wavs_chunk2932.wav
سرنوشت خودم نیز از عاقبت این کار متاثر می بود|wavs_chunk2933.wav
چندان دربندش نبودم حال عجیبی داشتم|wavs_chunk2934.wav
طلا بیشتر نبود و در ولایت غربت میان بیگانگان بودند|wavs_chunk2935.wav
همکاری داشتن و درآمدی برای گذران روز و امید و رهبر|wavs_chunk2936.wav
برای آینده و با این همه غم آینده را به دل راه نده|wavs_chunk2937.wav
اگر غم پارینا نبود خود را به تفریحی فامیل|wavs_chunk2938.wav
کتاب سرانجام مذهب نزدیکی ماجرا از ته دل میخندیدم|wavs_chunk2939.wav
اما کارفور اینا آینه عشقم را که درد میکرد|wavs_chunk2940.wav
آینده یک صوتی میشود ولی خوب باید است|wavs_chunk2941.wav
دربند آینده اولی زنده بودم دلم میخواست به اسرار|wavs_chunk2942.wav
پنهان میکند پیامبرم دلم میخواست بیاید و بگوید تو میدانی|wavs_chunk2943.wav
ست دارم وگرنه یعنی اگر یک خیال واهی این آرزویی|wavs_chunk2944.wav
چگونه من شدنی نبود خب|wavs_chunk2945.wav
می خواهم اگر میدانستم غیر از این چه می خواهم|wavs_chunk2946.wav
سرگشته بودم فقط میخواستم در کنارش باشم همین|wavs_chunk2947.wav
در پرتاب دو تا آخر عمر|wavs_chunk2948.wav
غیر از این هیچ نمی خواستم آخر مگر نمی توانستم از دور|wavs_chunk2949.wav
طبقه سوم در راه هایی که اتاق ها در آن بود|wavs_chunk2950.wav
ناگهان است این بود که چیزی بهم نخورد تکان میداد روی برگردان|wavs_chunk2951.wav
در ۲۰ عدد می خورد یا دور تر پلینار دیدم که از دربی|wavs_chunk2952.wav
مثل این بود که در کمین مانده بود در انتظار گذشتن من بود|wavs_chunk2953.wav
من برگشتم به اشاره را نزد خود خواند اولین آلکسا|wavs_chunk2954.wav
کاش من به نجوا گفت|wavs_chunk2955.wav
فکرش را می توانید بکنید انگار کسی به پهلوی من سوال بزن|wavs_chunk2956.wav
برگشتم شما را دیدم انگاری چیزی مثل برق از شما تشکر|wavs_chunk2957.wav
با امید رحمانی شان نگرانی بر سیما|wavs_chunk2958.wav
طوری که حرفم را اصلا نشنیده باشد گفت این نامه را بگیریم|wavs_chunk2959.wav
خودتان به دست مثل اصلی بدهید خواهش می کنم هر چه زودتر|wavs_chunk2960.wav
جواب نظم نیست او خودش|wavs_chunk2961.wav
من کرد با تعجب پرسیدم مستر اصلی بدهم|wavs_chunk2962.wav
اما حالا دیگر نبود به اتاقش رفته بود|wavs_chunk2963.wav
اساسین ها با هم مکاتبه دارند البته فور|wavs_chunk2964.wav
جستجوی مستر اصلی رفتم اول به تلاش رفتم ولی آنجا نبود|wavs_chunk2965.wav
به کازینو رفتم آنجا هم همین سالن ها را گشتم ولی رو پیدا نکردم|wavs_chunk2966.wav
عاقبت با اوقات تلخ میشود گفت با نا امیدی داشتم به خانه باز میگشتم|wavs_chunk2967.wav
به تصادف اوبامیانگ روحی سوار دیدم مرکب|wavs_chunk2968.wav
آیا بانوان انگلیسی که به جای می رفتند اشاره کرد|wavs_chunk2969.wav
و نامه را به او دادم ما فرصت نداشتیم که حتی|wavs_chunk2970.wav
نگاه کنیم نمیکنم به ام از بشر تا زنده|wavs_chunk2971.wav
حسادت بود که بر دلم تیر میکشید|wavs_chunk2972.wav
سقف فرو رفته و در مانده بود هیچی نداشتم سردرد|wavs_chunk2973.wav
حضور مخاطبشان چیست پس از قرار معلوم است|wavs_chunk2974.wav
با خود گفتم شکی نیست که اصلی دوست|wavs_chunk2975.wav
درست کردن اینجوری صمیمی بشود رابطه شان عاشقانه است|wavs_chunk2976.wav
عقل هوشم می گفت که نه اما در این گونه موارد|wavs_chunk2977.wav
عقل روا نیست در همه حال این هم یکی از مسائلی است که باید|wavs_chunk2978.wav
مسئله پیچیده میشود چه پیچیدگی ناخن|wavs_chunk2979.wav
هتل وارد نشده در بابلسر|wavs_chunk2980.wav
از اتاقش بیرون آمد به من خبر دادند که منتظر من اند|wavs_chunk2981.wav
سه بار سراغم را گرفتند و می خواهد هر چه زودتر به اتاقش|wavs_chunk2982.wav
حال روحیم هیچ خوب نبود در اتاق شنا|wavs_chunk2983.wav
از خود او را دیدم مثل بلند شدم تنها|wavs_chunk2984.wav
مادرش نبود مادر می‌شود گفت یدکی بود شخصی|wavs_chunk2985.wav
فقط جایی که لازم بود برای حفظ ظاهر نشان داده میشود|wavs_chunk2986.wav
مسائل جدی در میان بود مثل بلند کارهایش را تنها رفته|wavs_chunk2987.wav
حتی نمیدانم که این مادر از کارهای دختر مثل حتی خود|wavs_chunk2988.wav
چیزی می دانست آنها سه نفری درگیر به ۳۰ گرم بودند|wavs_chunk2989.wav
در اتاق را هم بسته بودند و این چیزی بود که هرگز دیده نشده بود|wavs_chunk2990.wav
صدای بلند دو گریه و تشخیص دادم که گستاخ و بگذر|wavs_chunk2991.wav
مظهر دشنام و تمسخر داشت و جنون آمیز بلند|wavs_chunk2992.wav
با صدای مسکین و موی واژن را که پیدا بود می کوشید از خود|wavs_chunk2993.wav
وقتی من وارد شدم همه خود را جمع و جور کردن در گوشی|wavs_chunk2994.wav
رفتار خود را اصلاح کنند و به سر خود کشید و موهای خود|wavs_chunk2995.wav
و سیمای غضبناک شروع لحظه خندان کرد|wavs_chunk2996.wav
لبخند زشت و مجازی نور سمانه و مودبانه فرانسوی|wavs_chunk2997.wav
که من از آن بسیار بیزارم ژنرال|wavs_chunk2998.wav
کوفته و سرگشته پشت خمیده اش را با حرکت غیر ارادی|wavs_chunk2999.wav
انگاری کوکی راست کرد فقط مادمازل بلانش|wavs_chunk3000.wav
صورتت از غصه درهم پیچیده خود را عوض نکرد و فقط با نگاه|wavs_chunk3001.wav
بی صبرانه در انتظار خود به من خیره ماند باید بگویم|wavs_chunk3002.wav
بوتان زمان همیشه به نهایت درجه نسبت به من بی اعتنا بود|wavs_chunk3003.wav
به سلام و کرنش من جواب نمی داد حتی منو نمیدی|wavs_chunk3004.wav
ژنرال با لحن به نرمی سرزنش آمیز|wavs_chunk3005.wav
الکسیویچ اجازه بدهید بگویم که|wavs_chunk3006.wav
نمی توانم بکنم واقعاً باور کردنی|wavs_chunk3007.wav
می خواهم بگویم که رفتار شما نسبت به من و خانواده|wavs_chunk3008.wav
سایت درجه عجیب و غیر قابل توجیه است|wavs_chunk3009.wav
با خشم به تحقیر آمیخته حرف او را برید که|wavs_chunk3010.wav
نه اینطور نیست آقای عزیز|wavs_chunk3011.wav
عزیز ما اشتباه می کند|wavs_chunk3012.wav
کارت خالت می کرد و به همه درس میدم اشتباه می کند|wavs_chunk3013.wav
اختیار می کنند ایشان فقط می خواهند بگویند|wavs_chunk3014.wav
می خواهم به شما هشدار بدهند یا بهتر است بگویم می خواهم|wavs_chunk3015.wav
از شما خواهش کنم که اسباب بدبختی|wavs_chunk3016.wav
اسباب بازی بختی|wavs_chunk3017.wav
طرز بیان درست همین است|wavs_chunk3018.wav
میان حرفش دیدم که چطور من چه کردم|wavs_chunk3019.wav
آخه آقا جان خودتان توجه دارید که راهنمایی این|wavs_chunk3020.wav
چطور بگویم این پیرزن عجوزه بینوا|wavs_chunk3021.wav
مردگان را به عهده گرفته اید آخر تا دینارا|wavs_chunk3022.wav
تمام هستی اش را می بست شما خودتان دیدید|wavs_chunk3023.wav
چه جوری بازی می کند وقتی شروع به باختن بکند از طریق|wavs_chunk3024.wav
دیگر از میز با کندری نخواهد بود|wavs_chunk3025.wav
دارو ندارش را آتش میزند در مواقع دیگر ممکن|wavs_chunk3026.wav
باخت هایش را جبران کند اصلاً شدنی نیست|wavs_chunk3027.wav
وقت ژنرال دنبال حرف های او را گرفت و گفت|wavs_chunk3028.wav
شماره ای که تمام خانواده را به خاک سیاه نشاند|wavs_chunk3029.wav
من و خانواده‌ام را ما وارثان|wavs_chunk3030.wav
شادی نزدیکتر از من دارد من را به شما میگویم|wavs_chunk3031.wav
من خیلی خراب است خراب شما خودتون|wavs_chunk3032.wav
آشنایید مبلغ قابل ملاحظه به واسطه|wavs_chunk3033.wav
چه بسا تمام اموالش را وای خدایا|wavs_chunk3034.wav
پسران ها بچه های من چه می آید|wavs_chunk3035.wav
این را که گفت نگاهی به تو گریه کرد|wavs_chunk3036.wav
مادمازل بلند که با تحقیر روی از رو گردان بود نگاه کن|wavs_chunk3037.wav
پسر من|wavs_chunk3038.wav
دامنجان اجازه دهید ما به شماست|wavs_chunk3039.wav
آخر چطور ژنرال شما خودتان بگویید|wavs_chunk3040.wav
مگر من چه کاره منه|wavs_chunk3041.wav
افزایش روشن کنید کنید|wavs_chunk3042.wav
بسیار گفتم من ولش کنم یکی دیگر را پیدا میکند|wavs_chunk3043.wav
و باز به میان حرف ما افتاد که نه|wavs_chunk3044.wav
راهکاری نیست|wavs_chunk3045.wav
نکنید ولی دست کم نصیحتش کنید با حرف م|wavs_chunk3046.wav
به کارت دیگری تشویقش کنید یا گرم|wavs_chunk3047.wav
گذاری زیاد ببازد هر جور ممکن باشد|wavs_chunk3048.wav
چیز دیگر منحرف کنید دنبال همین کتاب|wavs_chunk3049.wav
فیلم زنگ ساده لوحی با ندادم گفتم چطور|wavs_chunk3050.wav
چطور از شما خودتان این کار را به عهده بگیرید|wavs_chunk3051.wav
اینجا دیدم که باید با صدای بلند نگاه سریع و پر ساسانی به دو گروه|wavs_chunk3052.wav
دستهای خودت دوری او به قدرت لحظه ای حالتی ساده|wavs_chunk3053.wav
نتوانستن دهانش دارد و دست|wavs_chunk3054.wav
بخشنده گفت آخر مشکل این است که حالا مرا به عنوان|wavs_chunk3055.wav
راهنما نمی پذیرد ولی اگر بد ها|wavs_chunk3056.wav
نگاه سریع و بویایی به ما سلام کرد|wavs_chunk3057.wav
خود به جانب من پیش آمد و با لبخند فریبنده دستهایم را گرفت|wavs_chunk3058.wav
لوگو|wavs_chunk3059.wav
کلیپ لعنت بر شیطان شیطان|wavs_chunk3060.wav
چه سرعتی می توانست عوض شود صورتش در آن لحظه|wavs_chunk3061.wav
تماس با چه مهربان و لبخند چه معصومانه بود|wavs_chunk3062.wav
شیطنتی کودکانه که تمام شد با حرام|wavs_chunk3063.wav
و چنان که دیگران نبینند چشمکی بهم زد میخواستم|wavs_chunk3064.wav
در این کار مهارت بسیار داشت اما براستی بی حیا|wavs_chunk3065.wav
میخواستم وحشتناک بعد از فروش|wavs_chunk3066.wav
۱۸ آبان گفت|wavs_chunk3067.wav
چند دقیقه پیش آن حرف زدن منظورم این نبود|wavs_chunk3068.wav
التماس می کنم مثل یک روز شریف تا کمر جلو|wavs_chunk3069.wav
می کنم به تنها شما می توانید ما را نجات دهید|wavs_chunk3070.wav
به شما التماس می کنیم شما متوجه هستید|wavs_chunk3071.wav
میفهمید که این حرف را با لحن استغاثه پسرانه|wavs_chunk3072.wav
بنگاه مادمازل بدنش شهرکرد بینوا چه مسکین|wavs_chunk3073.wav
هنگام دست زدن سه ضرب|wavs_chunk3074.wav
در باز شده پیشخدمت مسئول ظاهر وارد شد و چند بود|wavs_chunk3075.wav
او با تاپیک ایستاده بود آنها از طرف مادر بزرگ آمد|wavs_chunk3076.wav
ماموریت داشتند که ما را پیدا کنند و هر چه زودتر به نظر شما بخرند|wavs_chunk3077.wav
تاپیک بهم نگفتی اوقات مادربزرگ تلخ است|wavs_chunk3078.wav
ولی آخر تازه ساعت سه و نیم است|wavs_chunk3079.wav
همش در رختخواب از این پهلو به پهلو می شد|wavs_chunk3080.wav
برخاستند و صندلی خواستند و دنبال شما فرستادند و جری در هتل|wavs_chunk3081.wav
غربت و فریاد زد|wavs_chunk3082.wav
