من خودم مثل همیشه می توانم بکشم از شما هم|wavs_chunk2229.wav
آدم ها را به دل نمیگیرم|wavs_chunk2230.wav
گرفتن به این سفر بیایم خیلی ساده|wavs_chunk2231.wav
خواننده سلام بیا اینجا|wavs_chunk2232.wav
کورینا پیش آمد و گفت|wavs_chunk2233.wav
بزرگی خیلی وقت است در راه اینه|wavs_chunk2234.wav
باقی همه آه و واویلا|wavs_chunk2235.wav
وقتی که همش خوابیده بودم و از دست دوا و دکتر|wavs_chunk2236.wav
عاقبت دکتر رها کردم و شما سه کلید|wavs_chunk2237.wav
خواستم که همین مرز|wavs_chunk2238.wav
آدما های علفی خوب کرد|wavs_chunk2239.wav
کسی که حسابی عرق کرد ما از رختخواب بلند شدم|wavs_chunk2240.wav
آلمانی ها جمع شدند و این کاشان را به چشم گذاشتند و شوخی کردم|wavs_chunk2241.wav
آخر سر گفتن اگر یک سفر به خارج بکنید در شهر|wavs_chunk2242.wav
آب معدنی حمام آب گرم و این حرفا معالجه را ادامه بدهید|wavs_chunk2243.wav
عوارض روده تنها با خودم گفتم چرا|wavs_chunk2244.wav
زگیل و حلالش گفتند واویلا کجا این همه راه|wavs_chunk2245.wav
دیوانگیست حمام گوشم بدهکار این حرفا نبود یک روز|wavs_chunk2246.wav
هفته پیش یکی از دخترها را برداشتم و با پا پیچ ۳۲|wavs_chunk2247.wav
پیشخدمت همراه شد و در فراز برلین برگرداندم|wavs_chunk2248.wav
احتیاجی بودم و خودم تک و تنها می توانم بیایم اینجا|wavs_chunk2249.wav
کوپه مخصوص گرفتم در همه ایستگاه ها بار بر فراوان است|wavs_chunk2250.wav
۱۲۵ که بخواهی می برند|wavs_chunk2251.wav
خود را تماشا کرد و گفت شما اینجا گرفته|wavs_chunk2252.wav
روش نگهداری کرد و گفت پدر کم|wavs_chunk2253.wav
کاش می کنی که همه چیز در گرو گذاشته ای|wavs_chunk2254.wav
فرانسوی کلی بدهکاری من از سیر تا پیاز از خبر دارم|wavs_chunk2255.wav
سخت تجارت کشید و گفت من|wavs_chunk2256.wav
خانم ها خیلی تعجب می کنم من فکر می کنم|wavs_chunk2257.wav
سهیم نیستم که احتیاج به سرپرستی چه کسی|wavs_chunk2258.wav
گذشته خرج مستغلات تجاوز نمی کند و ما اینجا|wavs_chunk2259.wav
تجاوز نمی کند|wavs_chunk2260.wav
آخرین دینار مال بچه های صغیر هم بالا کشیده ای|wavs_chunk2261.wav
مثلا آقاییم هست|wavs_chunk2262.wav
انتشار گفت بعد از این بعد از این حرفا|wavs_chunk2263.wav
من دیگر نمی دانم|wavs_chunk2264.wav
جدایی نداری هستی خانواده اش را به من داده ای|wavs_chunk2265.wav
چه خوردی از فرط هیجان چیزی نمانده|wavs_chunk2266.wav
خال خانم من آبرو دارم|wavs_chunk2267.wav
این فرم به او گفتم معلوم است|wavs_chunk268.wav
کیف می کنم همین که به شما اجازه می دهم|wavs_chunk269.wav
سالها از من بکنید این حسا رو بزنید برای جبران اوقات تقویت آن کافی است|wavs_chunk270.wav
با خونسردی در جوابش گفتم من حقیقتا به خودم|wavs_chunk271.wav
دیدم که همه جور سوال از شما بکنم خواسته به این جهت که حاضرم هر جور که بخواد|wavs_chunk272.wav
تلافی کنم و به این دلیل که جان خود را در مقابل شما قابل نمی دانم|wavs_chunk273.wav
اولین آگاه که خندید و گفت شما خیلی مبارکه|wavs_chunk274.wav
بودیم گفت حاضری به یک اشاره من خودتان را با سر به دره|wavs_chunk275.wav
به آنجا در خیلی عمیق بود هزار فوت می شد|wavs_chunk276.wav
من عاقبت یک روز این اشاره خواهم کرد فقط برای امتحان|wavs_chunk277.wav
می خوام ببینم این تلافی که میگوید لاف نیست و راست می گویید|wavs_chunk278.wav
یقین بدانید که ابداً ملاحظه نخواهم کرد من از شما|wavs_chunk279.wav
مخصوصاً برای اینکه بیش از اندازه تان به تان می داند|wavs_chunk280.wav
بیشتر از آن برای اینکه اینقدر به شما احتیاج دارم|wavs_chunk281.wav
اجالتا لازم ندارم باید حفظتان کنم|wavs_chunk282.wav
خواست برخیزد از حرف هایش پیدا بود که سخت از کوره در رفته است|wavs_chunk283.wav
این اواخر همیشه گفتگو هایش را با خشم و ابراز کینه تمام می کرد|wavs_chunk284.wav
من که نمیخواستم تو را بی آنکه|wavs_chunk285.wav
رها کنم گفتم اجازه بدهید بپرسم این مادمازل بلانش کیست|wavs_chunk286.wav
شما خودتون خوب میدونید کیست هیچ چیزی نسبت به گذشته|wavs_chunk287.wav
به احتمال زیاد مثل پلاس خانم جنرال خواهد شد|wavs_chunk288.wav
وقتی که شایعه مرگ مادربزرگ تایید شود|wavs_chunk289.wav
مامان جانشین مارکی که نسبت به بسیار دورو دارد|wavs_chunk290.wav
همه میدانند که ما دیگر در بساط نداریم|wavs_chunk291.wav
واقعا عاشق است مسئله ای نیست|wavs_chunk292.wav
خودتان را باز کنید تا چیزی را که می گویم به خاطر بسپارید|wavs_chunk293.wav
فلورن را بردارید و بروید کازینو بازی کنید و سعی|wavs_chunk294.wav
هرچه می توانی بیشتر برای ببرید من خیلی پولدار|wavs_chunk295.wav
به حقیقت می باشد این را گفتند|wavs_chunk296.wav
صدا کرد و با او به ایثار و به دیگران پیوست|wavs_chunk297.wav
راهی که پیدا شد به سمت چپ پیچیدن در فکر|wavs_chunk298.wav
دستور تازه او که برایش بازیکن مهاجم مانده بودند|wavs_chunk299.wav
خیلی عجیب بود اگرچه کاری زیادی ذهنم را مشغول می دهد|wavs_chunk300.wav
در تحلیل احساسات من نسبت به پایین و عمیق شدن حقیقت|wavs_chunk301.wav
دو هفته هرمان آسوده تر از حالا بودم که به او رسیده بودم|wavs_chunk302.wav
گرچه سفر هم دلم برایش بسیار تنگ میشد و مثل دیوانه ها بی قرار|wavs_chunk303.wav
عطا در خواب مادام با او بودم حتی یک بار در|wavs_chunk304.wav
قطار به خواب رفتم ظاهراً به صدای بلند با پرینا حرف زده بودم|wavs_chunk305.wav
همه مسافران کوفه را به خنده انداخته بود امروز|wavs_chunk306.wav
دیگر با خودم میگفتم آیا به راستی دوستش دارم|wavs_chunk307.wav
بار دیگر نتوانستم به این پرسش خود پاسخی بدهم|wavs_chunk308.wav
یعنی بهتر است بگویم که باز برای صدمین بار به خود جواب داد|wavs_chunk309.wav
سوکی در دل دارم می پرسیدم|wavs_chunk310.wav
گاهی میشد هر بار درست بعد از گفتگو با او که حاصل|wavs_chunk311.wav
نیمی از عمر خودم را بدهم به شرط اینکه بتوانم خفش کنم|wavs_chunk312.wav
قسم میخورم که اگر ممکن بود که پنجره چیزی را نرم نرمک در سین|wavs_chunk313.wav
گمان می‌کنم که خودداری نمیکردم از این کار لذت ببرید|wavs_chunk314.wav
با این حال به همه مقدسات سوگند می خورم که|wavs_chunk315.wav
روی قله شلنگ نبر بودیم روی همان تیغه ای که همه|wavs_chunk316.wav
تماشا با آن بالا می روند اگر به من گفته بود خودتان را فرو اندازی|wavs_chunk317.wav
خود را به دردسر انداخته بودم آنها بالصحة|wavs_chunk318.wav
معنی یقین داشتم به این جهت می‌بایست مسئله برایم یک‌سویه شود|wavs_chunk319.wav
این همه رو خوب می فهمید می دانست که به درستی و روشنی|wavs_chunk320.wav
من که وصالش برایم محال است و به یاد بودن خیالت|wavs_chunk321.wav
رویاهایم به خوبی آگاه هم را هم میدانم که علم|wavs_chunk322.wav
گل برایش موجب لذت بسیار بود اگر این طور نبود|wavs_chunk323.wav
چطور ممکن بود دختری به زیرکی و مال اندیشی با من اینجوری|wavs_chunk324.wav
باشد و پرده همه چیزش را برایم بگوید|wavs_chunk325.wav
نظر می‌رسد که بود تا امروز به چشما شهبانوی|wavs_chunk326.wav
به من نگاه کرده است که در حضور بندر یافت می شد|wavs_chunk327.wav
زیرا آدم نمیشه مرد  آره|wavs_chunk328.wav
پیش می آید که ما را آدم حساب نکنند|wavs_chunk329.wav
بهمن مأموریت داده بود که برایش رولت بازی کنم و به|wavs_chunk330.wav
قیمت شده مبلغ هنگفتی برم من فرصت نداشتم فکر کنم|wavs_chunk331.wav
آمپول برای چه می خواهد و من چه مدت مهلت دارد|wavs_chunk332.wav
به انجام برسانم و چه افکاری در ذهن بی قرار و همیشه|wavs_chunk333.wav
پیدا شده است از این گذشته پیدا بود در این دو هفته|wavs_chunk334.wav
زیادی روی داده بود که من از آنها اطلاعی نداشتم|wavs_chunk335.wav
همه را می بایست حرف بزنند و به حقیقت آنها پی ببرم هر چه زودتر|wavs_chunk336.wav
اما عجالتاً فرصتی برای این کار نداشتم|wavs_chunk337.wav
کازینو|wavs_chunk338.wav
|wavs_chunk339.wav
فصل دوم|wavs_chunk340.wav
حقیقت این است که این کار چندان باب طبع نبود|wavs_chunk341.wav
تصمیم گرفته بودم بازی کنم اما هیچ فکر کرده|wavs_chunk342.wav
کار با پول دیگران و برای آنها شروع کنم|wavs_chunk343.wav
حال کمی گیج شده و وقتی به سالن بازی وارد شدن هکر بودن|wavs_chunk344.wav
از همون نگاه اول دلم از همه چیز آنجاست به هم خورد|wavs_chunk345.wav
چاکر منشی که در پاورقی های روزنامه های تمام دنیا|wavs_chunk346.wav
مجلات روسی دیده می شود برایم دشوار است تقریباً هر سال|wavs_chunk347.wav
پاورقی نویسان درباره دو چیز قلمفرسایی میکند|wavs_chunk348.wav
یکی شکوه خیره کننده و تجمل فوق العاده قمارخانه‌های مراکز|wavs_chunk349.wav
کنار راین سکه طلایی که به|wavs_chunk350.wav
آنها روی میز های بازی تو دیده می شود چرا|wavs_chunk351.wav
گزینه هایی که بابت این تبلیغات به این آقایان پول نمی دهند|wavs_chunk352.wav
اینها همینطور بیقرار از خانه فقط از راه خوش خدمتی داستان های خدا|wavs_chunk353.wav
توهم بیاراید در سالن های زشت ترین خانه ها|wavs_chunk354.wav
خیره کننده نیست و فقط تل طلایی روی میز|wavs_chunk355.wav
چه می‌شود گفت که آنجا چندان طلایی به چشم می آید|wavs_chunk356.wav
البته گاهی اتفاق می‌افتد آنان که دیوانه|wavs_chunk357.wav
پولداری انگلیسی یا آسیایی ثروتمندی یا مثلا|wavs_chunk358.wav
آنان که همان سال از آن سر دنیا را هم می کنند و می آیند|wavs_chunk359.wav
مدت کوتاهی مبالغ هنگفتی می برند یا می باشد|wavs_chunk360.wav
باقی بخت آزمایی آن چند گل زده شد و به طور|wavs_chunk361.wav
پول فراوانی روی میز دیده نمی شود وقتی به سالن|wavs_chunk362.wav
وارد شدن به این اولین بار بود که به این جوجه ها می رفتم|wavs_chunk363.wav
بازی به بازی نمی شدند از این گذشته جمعیت زیاد بود|wavs_chunk364.wav
تنها می بودم به آن می کنم بیشتر دلم میخواست برگردم اصلاً بازی|wavs_chunk365.wav
اقرار می کنم که قلبم به شدت می توانید هیچ|wavs_chunk366.wav
یقین داشتم که به این سادگی یعنی در همان وضعیت|wavs_chunk367.wav
گروه تنبور را ترک نخواهم کرد از مدت ها پیش|wavs_chunk368.wav
تصمیم خود را گرفته بودم می دانستم که بی شک اتفاقی برا|wavs_chunk369.wav
گل سرنوشتم اثری عمیق و بتی|wavs_chunk370.wav
باید چنین باشد و همین طور هم خواهد شد|wavs_chunk371.wav
هرچند که امیدم به این که از این چرخ نصیب قابل‌ملاحظه‌ای ببرم|wavs_chunk372.wav
عقیده معمولا همگانی را که بنا به آن امید برد به|wavs_chunk373.wav
خانه است فکر می دانستم چه کسی|wavs_chunk374.wav
قمار و شیوه های دیگر تحصیل پول از تجارت ناپسندیده|wavs_chunk375.wav
درست است که در قمار از صد نفر یک نفر نسیمی|wavs_chunk376.wav
ولی من به این جنبه بازی کاری ندارم|wavs_chunk377.wav
بر تقدیر من تصمیم داشتم که ابتدا فقط تماشا کنم با دقت|wavs_chunk378.wav
امشب هیچ قدم مهمی بر ندارم اگر چیزی|wavs_chunk379.wav
میشد فقط اثر تصادف می کند و گذرا|wavs_chunk380.wav
ملاحظه نمی بود فرض منی|wavs_chunk381.wav
بازی را یاد بگیرم هرچند بسیاری را با نهایت علاقه مندی|wavs_chunk382.wav
درباره چرخ بخت خوانده بودم تا به چشم خود شیوه باز ایران|wavs_chunk383.wav
از خنده هایم چیزی دستگیرم نمی شد|wavs_chunk384.wav
ابتدا همه چیز به نظرم بسیار کثیف میرسید اخلاقی|wavs_chunk385.wav
منظورم ابداً دهها و صدها پول روی بی قرار|wavs_chunk386.wav
دور میز رولت جمع می شود من در میان مردم و بردن حرف|wavs_chunk387.wav
روسری طرح پول هیچ چیز ناپاک نمی بینم منحرفان|wavs_chunk388.wav
میشمارم که با شکم سیر خیال راحت درس اخلاق می دهد|wavs_chunk389.wav
در جواب کسی که در توجیه بازی خود می‌آورد که کلان بازی نمیکنم|wavs_chunk390.wav
دیگر بدتر زیرا این نشانه حقارت حرص است|wavs_chunk391.wav
حقیر و طمع بلنده مثال با هم فرقی دارد|wavs_chunk392.wav
مسئله نسبی است آنچه برای رشد شیلد حقیر می نماید|wavs_chunk393.wav
کلان است درباره برد و سود ورزی حقیقت این است که|wavs_chunk394.wav
فقط دور میز رولت و بساط قمار بلکه همه جا|wavs_chunk395.wav
سعی میکنند چه چیزی بیرون می آورند|wavs_chunk396.wav
اما اینکه بهره و سود به طور کلی چیست|wavs_chunk397.wav
پلی لیست مهستی|wavs_chunk398.wav
پرداختن به آن را ندارد از آنجا که من|wavs_chunk399.wav
بند برد اسیر بودن تمام این حرص|wavs_chunk400.wav
پلیدی طمع پول از همان اول ورود به سالن بازی|wavs_chunk401.wav
گفت بیشتر به من می چسبید و با وجودم|wavs_chunk402.wav
از همه خوشایند تر این است که بازی کنندگان از همراه اول|wavs_chunk403.wav
ندارند و خجالت نمی کشند و صاف و پوست کنده کارشان|wavs_chunk404.wav
اصلا چه معنی دارد که آدم خودش را گول بزند|wavs_chunk405.wav
این بیهوده ترانا عاقلانه‌تر نیست در اولین نظر از همه|wavs_chunk406.wav
ناخن شاین تر نقاب متانتی است که این اراذل دورهمی|wavs_chunk407.wav
و جدیت که هنگام بازی از خود نشان می‌دهند و احترام|wavs_chunk408.wav
چرخ می گذارند به این دلیل است که این جامی|wavs_chunk409.wav
بازی ناپسند می شمارند چه بازی پسندیده دانسته می شود|wavs_chunk410.wav
برای بای سگان جایز است تمایز چشمگیر است|wavs_chunk411.wav
دو شیوه بازی هست یکی بازی آقا|wavs_chunk412.wav
به شیوه به اصطلاح جنتلمن هاست و دیگری بازی|wavs_chunk413.wav
حریصانه از توبه نشان پول جوی مشخص است|wavs_chunk414.wav
مرز میان این دو نوع بسیار نمایان است و چه زشت|wavs_chunk415.wav
یک جنتلمن ممکن است ۵ یا دهلوی طلاب بازی بگذارد|wavs_chunk416.wav
اگر بیشتر بگذارد استثنایی است یا اگر بسیار ثروتمند|wavs_chunk417.wav
هزار فرسنگ خیلی قشنگ فقط بازی و تفریح است|wavs_chunk418.wav
خواهر روند برد یا باخت را تماشا کند و بدون توجه|wavs_chunk419.wav
یا مبلغان ندارد اگر ببرد|wavs_chunk420.wav
ممکن است مثلا به صدای بلند بخندد یا به یکی از اطرافیانش لطیف|wavs_chunk421.wav
آیا ممکن است بار دیگر بازی کند یا بر مبلغ مایع|wavs_chunk422.wav
اما انگیزش فقط کنجکاوی است|wavs_chunk423.wav
چگونگی سیر بخت و حساب احتمالات و نهر|wavs_chunk424.wav
بردن پول از رذالت است خلاصه اینکه|wavs_chunk425.wav
میزهای بازی را از رولت گرفته تا بازی های دیگر وسایل|wavs_chunk426.wav
شماره ای که برای لذت ترتیب داده شده است|wavs_chunk427.wav
او به خود اجازه بدگمانی نسبت به بانک نمی دهد و حتی خیال تو|wavs_chunk428.wav
روپیه و طلا هایی که رونق بانک بر آنها استوار است در ذهنش|wavs_chunk429.wav
خط و نشان تشخص بلندنظری آن است که|wavs_chunk430.wav
که همه کسانی که در کنارش اطراف میز بازی اند و یکی دو گلدان|wavs_chunk431.wav
ایشان بسته است مثل خودش ثروتمند و منش و فقط برای تو|wavs_chunk432.wav
سرگرمی بازی می کنند این بی خبری کامل از واقعیت|wavs_chunk433.wav
نگاه خالی از بدگمانی بر مردم البته از بزرگ منشی و خصلت|wavs_chunk434.wav
است من مادران بسیاری را می دیدم|wavs_chunk435.wav
۱۵ ۱۶ ساله خود را به کنار میز پیش میکند و چند سال|wavs_chunk436.wav
چرا در دستشان می گذاشتند و بازی را برایشان توضیح می‌دادند|wavs_chunk437.wav
این دوشیزگان جوان می بردند یا میباختم درهمه|wavs_chunk438.wav
لبخند بر لب داشتن و بسیار راضی بودند|wavs_chunk439.wav
حال ما هم با جسارت و متانت بسیار به میز نزدیک شد|wavs_chunk440.wav
صندلی برای کنار میز بگذارد اما جنرال اعتنایی به اینکه|wavs_chunk441.wav
مدتی دراز طول کشید تا کیف پولش را بیرون آورد و باز هم|wavs_chunk442.wav
تا ۳۰۰ پراید طلا از آن بردارد روی رنگ سبز|wavs_chunk443.wav
ماهی گذاشت و برد اما برد خود را جمع کرده و همچنان روی|wavs_chunk444.wav
گذشته بار دیگر سیاه برد این بار نیز برد|wavs_chunk445.wav
و چون این بار سرخ برنده شد یکجا ۱۲۰۰ فرانک باخت|wavs_chunk446.wav
تو خندان از نیز دور شد و توانست خود را در اختیار دارد|wavs_chunk447.wav
من یقین دارم که در آن‌ها اگر تیغش میزدی خونش جاری نمی شد|wavs_chunk448.wav
اما به روی خودش نیاورد ولی اگر پولی که گذاشته بود|wavs_chunk449.wav
برابر میبود طاقتش را نمی داشت تلخ‌کامی ظاهر می شد|wavs_chunk450.wav
حالا که در کنار من یک نفر فرانسوی بود که نزدیک ۳۰۰۰۰ فرانکفورد|wavs_chunk451.wav
مذهب را باخت و خم به ابرو نیاورد کسی که براش|wavs_chunk452.wav
منش باشد حتی اگر تمام هستی خود را ببازد|wavs_chunk453.wav
درخواست ظاهر سازی چقدر پول باید به اندازه|wavs_chunk454.wav
ناچیز باشد که نبودش نتواند آرامش او را برهم زند|wavs_chunk455.wav
البته شرط نجابت حقیقی این است که اصلاً متوجه این لجنی که|wavs_chunk456.wav
دورمیز میجوشد اوباش که در آن لجن پول می گویند|wavs_chunk457.wav
نشوی اما از طرف دیگر گاهی طریق عکس|wavs_chunk458.wav
بسیار کمتر از آن نشان اشرافیت نیست یعنی بازی|wavs_chunk459.wav
چشم بر همه چیز و باریک شدن در دقایق مشاهده بازی|wavs_chunk460.wav
نوحه غارت شان با دقت یک ذره بین|wavs_chunk461.wav
خیلی باباش لجن تالار بازی را به صورت نوعی سرگرمی|wavs_chunk462.wav
به صورت نمایشی که فقط برای تفریح تو تعطیل|wavs_chunk463.wav
البته ممکن است که آدم خود را به زور|wavs_chunk464.wav
جمع جا کند اما باید چشم به اطراف خود داشته باشد با یقین کامل|wavs_chunk465.wav
تماشاگر است و یکی از آنها در جمع نیست|wavs_chunk466.wav
مشاهده بیش از اندازه دقیق نیز شایسته نیست و باز|wavs_chunk467.wav
آقا منشی دور است|wavs_chunk468.wav
ارزش آن را ندارد که یک شخص بزرگ منش بیش از اندازه|wavs_chunk469.wav
باریک شود به طور کلی کمتر نمایشی است که|wavs_chunk470.wav
مشاهده بیش از اندازه یک آقا منش راستین را داشته باشد|wavs_chunk471.wav
با همه این حرفها مشخص با میکردم که اینها همه|wavs_chunk472.wav
ارزش مشاهده و مطالعه دقیق رادارد خواستین|wavs_chunk473.wav
فقط به قصد تماشا نیامده بودم و خود را صادقانه و در|wavs_chunk474.wav
آلودگی شدن جزء این جمع رازه میشمردم|wavs_chunk475.wav
عقاید اخلاقی پنهان داشته خودم چه بود|wavs_chunk476.wav
میگویم جای آنها البته داریم بحث نیست ولی خوب قبول دارم|wavs_chunk477.wav
با شماست این حرف ها را بیشتر برای آسودگی وجدان خودم|wavs_chunk478.wav
یک چیز را بگویم اواخر نفرت|wavs_chunk479.wav
اعمال و افکار خود را با موازین اخلاقی|wavs_chunk480.wav
عامل دیگری بود که مرا هدایت می کرد|wavs_chunk481.wav
بازی اراذل به راستی ناپاک نفرت انگیز است|wavs_chunk482.wav
بگویم که دزدی های آشکارا به راستی حقیری|wavs_chunk483.wav
صرافی هایی که در دو سر میز می نشیند و|wavs_chunk484.wav
بازی نظارت و برد و باخت بازی کنندگان را حساب میکنند|wavs_chunk485.wav
کار بسیار دشواری برعهده دارد که تازه آنها خود گرگ ها|wavs_chunk486.wav
بیشتر فرانسوی البته با نی|wavs_chunk487.wav
مشاهدات خودم را نقد می کنم و بدون قصد ندارم که با|wavs_chunk488.wav
در روز رولت موشکافی کنم من می خوام|wavs_chunk489.wav
چم و خم این بازی خوب بگیرم تا بدانم که در آینده چه کنم|wavs_chunk490.wav
دیدم که ناگهان دستی روی میز دراز می شود و تمام پولی را که شما برده اید|wavs_chunk491.wav
این رویداد بسیار معمولی است|wavs_chunk492.wav
گوه می‌شود که خواهش می کنم ثابت کنید شاید بیاوریم که این پول|wavs_chunk493.wav
من ابتدا از این مسخره بازی ها چیزی|wavs_chunk494.wav
همه برایم معما بود فقط بهت|wavs_chunk495.wav
